image,question,answer
image1,Do carcinoid tumors form a submucosal nodule composed of tumor cells embedded in dense fibrous tissue?,yes
image1,Do the cytologic features of cis form a submucosal nodule composed of tumor cells embedded in dense fibrous tissue?,no
image1,Do neutrophils assume a salt-and-pepper pattern?,no
image1,"Does the chromatin texture,  with fine and coarse clumps,  assume a salt-and-pepper pattern?",yes
image1,Does granulomatous host response show the bland cytology that typifies neuroendocrine tumors?,no
image1,Does high magnification show the bland cytology that typifies neuroendocrine tumors?,yes
image2,Is the high-power detail of an asbestos body associated with NSAID use?,no
image2,Is the antral ulcer associated with NSAID use?,yes
image3,Are hilar lymph nodes with caseation seen left?,yes
image3,Are two helical spirochetes seen left?,no
image3,Is scarring under the pleura in the lower part of the upper lobe?,no
image3,Is the gray-white parenchymal focus under the pleura in the lower part of the upper lobe?,yes
image4,Is acute rheumatic mitral valvulitis dark congestion of the renal surface between the abscesses?,no
image4,Is there dark congestion of the renal surface between the abscesses?,yes
image4,"Is acute coronary throm-bosis studded with focal pale abscesses,  more numerous in the upper pole and middle region of the kidney?",no
image4,"Is the cortical surface studded with focal pale abscesses,  more numerous in the upper pole and middle region of the kidney?",yes
image4,Is the surrounding lung relatively unaffected?,no
image4,Is the lower pole relatively unaffected?,yes
image5,Is the interstitial vasculature presence of abundant coarse black carbon pigment in the septal walls and around the bronchiole?,no
image5,Is there presence of abundant coarse black carbon pigment in the septal walls and around the bronchiole?,yes
image6,What point to inflammation surrounding islet of Langerhans?,arrows
image6,Are clusters of pigmented hepatocytes with eosinophilic cytoplasm essentially normal?,no
image6,Are the surrounding acinar structures essentially normal?,yes
image6,"Do a few interspersed neutrophils,  much smaller in size and with compact,  lobate nuclei,  point to inflammation surrounding islet of Langerhans?",no
image7,Is this tumor composed of small cells embedded in a finely fibrillar matrix?,yes
image7,Is the late-phase reaction composed of small cells embedded in a finely fibrillar matrix?,no
image7,Is a Homer-Wright pseudorosette seen in the upper right corner?,yes
image7,Is deposition of antibody on endothelium and activation of complement seen in the upper right corner?,no
image8,Does the incised wound as well as suture track on either side show markedly dilated pelvis and calyces having irregular and ragged inner surface and containing necrotic debris and pus?,no
image8,Does sectioned surface show markedly dilated pelvis and calyces having irregular and ragged inner surface and containing necrotic debris and pus?,yes
image9,"Do iron deposits shown by a special staining process demonstrate capsular invasion that may be minimal,  as in this case,  or widespread,  with extension into local structures of the neck by contrast?",no
image9,"Do follicular carcinomas demonstrate capsular invasion that may be minimal,  as in this case,  or widespread,  with extension into local structures of the neck by contrast?",yes
image10,"Are a few interspersed neutrophils,  much smaller in size and with compact,  lobate nuclei,  evident?",no
image10,Are the bridging strands of fibrous tissues evident?,yes
image11,Are the vascular changes necrotising arteriolitis and hyperplastic intimal sclerosis or onion-skin proliferation?,yes
image11,Are numbers necrotising arteriolitis and hyperplastic intimal sclerosis or onion-skin proliferation?,no
image11,"Are the parenchymal changes tubular loss, fine interstitial fibrosis and foci of infarction necrosis?",yes
image11,"Are the bronchioles as well as the adjacent alveoli tubular loss, fine interstitial fibrosis and foci of infarction necrosis?",no
image12,Does the peripheral zone show mild fatty change of liver cells?,yes
image12,Does the cytoplasm show marked degeneration and necrosis of hepatocytes accompanied by haemorrhage while the peripheral zone shows mild fatty change of liver cells?,no
image12,Does the centrilobular zone show marked degeneration and necrosis of hepatocytes accompanied by haemorrhage while the peripheral zone shows mild fatty change of liver cells?,yes
image12,Does the pink acellular amyloid material show mild fatty change of liver cells?,no
image13,"Do those with tumors that had mycn amplification show diffuse granular cyto-plasm,  reflecting accumulated hepatitis B surface antigen HBsAg in chronic infections?",no
image13,"Do infected hepatocytes show diffuse granular cyto-plasm,  reflecting accumulated hepatitis B surface antigen HBsAg in chronic infections?",yes
image14,Is histopathologic features of condyloma acuminatum associated with the spread of organisms in the perivascular spaces?,no
image14,Is the whole-brain section showing the numerous areas of tissue destruction associated with the spread of organisms in the perivascular spaces?,yes
image15,"Do testicular teratomas contain mature cells from endodermal,  mesodermal,  and ectodermal lines?",yes
image15,"Do small nests of epithelial cells and myxoid stroma forming cartilage and bone contain mature cells from endodermal,  mesodermal,  and ectodermal lines?",no
image16,What is the nodularity caused by in other cases of nodular hyperplasia?,stromal
image16,"Does four-chamber dilation and hypertrophy demonstrate a well-demarcated nodule at the right of the field,  with a portion of urethra seen to the left?",no
image16,"Does low-power photomicrograph demonstrate a well-demarcated nodule at the right of the field,  with a portion of urethra seen to the left?",yes
image16,"Is the nodularity caused predominantly by stromal,  rather than glandular,  proliferation in other cases of nodular hyperplasia?",yes
image16,"Is typical tuberculous granuloma showing an area of central necrosis caused predominantly by stromal,  rather than glandular,  proliferation in other cases of nodular hyperplasia?",no
image16,"What is caused predominantly by stromal,  rather than glandular,  proliferation in other cases of nodular hyperplasia?",nodularity 
image17,Is atrophy seen in the brain?,yes
image17,Is reversible injury caused by aging and reduced blood supply?,no
image17,Have the meninges been stripped from the bottom half of each specimen to show the surface of the brain?,yes
image17,What of the brain is caused by aging?,atrophy 
image17,Have the necrotic cells been stripped from the bottom half of each specimen to show the surface of the brain?,no
image17,Is atrophy of the brain caused by aging and reduced blood supply?,yes
image18,Do plexiform areas show irregular plexiform masses and network of strands of epithelial cells?,yes
image18,Do common locations and the regions of involvement show central cystic change?,no
image18,Are miliary composed of central area of stellate cells and peripheral layer of cuboidal or columnar cells?,no
image18,Are epithelial follicles composed of central area of stellate cells and peripheral layer of cuboidal or columnar cells?,yes
image18,Do a few areas show central cystic change?,yes
image19,Is hyperplasia with atypia seen as glandular crowding and cellular atypia?,yes
image19,"Is a binucleate reed-sternberg cell with large,  inclusion-like nucleoli and abundant cytoplasm seen as glandular crowding and cellular atypia?",no
image20,"Does normal bone marrow in an adult show combination of mucinous, squamous and intermediate cells?",no
image20,"What shows combination of mucinous, squamous and intermediate cells?",tumour
image20,"Does the tumour show combination of mucinous, squamous and intermediate cells?",yes
image21,Are the tube and ovary to the left of the uterus totally obscured by a hemorrhagic inflammatory mass?,yes
image21,Is the kidney adherent to the adjacent ovary on the other side?,no
image21,Is the tube adherent to the adjacent ovary on the other side?,yes
image21,Are edema totally obscured by a hemorrhagic inflammatory mass?,no
image22,Does the cellular adaptation depicted here consist of numerous swollen villi?,no
image22,Does the complete hydatidiform mole consist of numerous swollen villi?,yes
image23,Are distended hydropic villi and proliferation of the chorionic epithelium evident in this microscopic image?,yes
image24,"Is borderline serous cystadenoma opened to show a large,  bulky tumor mass?",no
image25,"Is part of the endocervical mucosa comprised of ducts, acini, tubules, sheets and strands of cuboidal and myoepithelial cells?",no
image25,"Is the epithelial element comprised of ducts, acini, tubules, sheets and strands of cuboidal and myoepithelial cells?",yes
image25,What is the epithelial element comprised of?,ducts
image26,Is m phase required for transcutaneous fnac?,no
image26,What is required for transcutaneous fnac?,equipments
image26,Is equipments required for transcutaneous fnac?,yes
image27,Is hyperplasia without atypia characterized by nests of closely packed glands?,yes
image27,Is endoscopic view of a longitudinally-oriented mallory-weiss characterized by nests of closely packed glands?,no
image28,Are this diagrammatic representation of four normal motor units present?,no
image28,"Are superficial dermal fibrosis and vascular ectasia,  both common features,  present?",yes
image29,What is small and contracted?,kidney
image29,Is small contracted kidney in chronic hypertension benign nephrosclerosis?,yes
image30,Is this degree of external dysmorphogenesis associated with severe internal anomalies such as maldevelopment of the brain and cardiac defects in almost all cases?,yes
image30,"Is the granuloma in the center associated with a lethal malformation,  in which the midface structures are fused or ill-formed?",no
image30,"Is stillbirth associated with a lethal malformation,  in which the midface structures are fused or ill-formed?",yes
image30,"What is associated with a lethal malformation,  in which the midface structures are fused or ill-formed?",stillbirth
image30,Are the midface structures fused or ill-formed?,yes
image30,Is atrophy associated with severe internal anomalies such as maldevelopment of the brain and cardiac defects in almost all cases?,no
image31,Is islet inflammation noted at earlier observations?,yes
image31,"Is the glomerulus observed late in the natural history of this form of diabetes,  with islet inflammation noted at earlier observations?",no
image31,"Is the tan-colored,  encapsulated small tumor noted at earlier observations?",no
image31,"What is observed late in the natural history of this form of diabetes,  with islet inflammation noted at earlier observations?",amyloidosis
image31,"Is Amyloidosis observed late in the natural history of this form of diabetes,  with islet inflammation noted at earlier observations?",yes
image32,Is formation of granulation tissue no invasion across the basement membrane?,no
image32,Is there no invasion across the basement membrane?,yes
image32,Do the individual cells in layers show features of cytologic atypia and mitosis?,yes
image32,Is the necrosed area on right side of the field keratosis and orderly arrangement of increased number of layers of stratified mucosa?,no
image32,Is the pleural surface of the specimen of the lung increased?,no
image32,Is the number of layers increased?,yes
image32,Is there keratosis and orderly arrangement of increased number of layers of stratified mucosa?,yes
image32,Do defects in any of the six show features of cytologic atypia and mitosis?,no
image33,How are the individual tumour cells?,small
image33,"Are the individual tumour cells small, uniform, lymphocyte-like with scanty cytoplasm?",yes
image33,"Are the atypical dysplastic squamous cells small, uniform, lymphocyte-like with scanty cytoplasm?",no
image33,"Are the tumour cells arranged in sheets, cords or aggregates and at places form pseudorosettes?",yes
image33,What are the tumour cells arranged in?,sheets
image33,"Are the alveoli and respiratory bronchioles surrounding the coal macule arranged in sheets, cords or aggregates and at places form pseudorosettes?",no
image34,Is a giant cell with inclusions toxic to macrophages?,no
image34,Are the tiny silica particles toxic to macrophages?,yes
image35,Is early organization of intraalveolar exudate seen?,yes
image36,"Were all three transverse sections of myocardium absent in the rectum,  but presented in the sigmoid colon?",no
image36,"Were ganglion cells absent in the rectum,  but presented in the sigmoid colon?",yes
image37,Are a distinct nuclear inclusion and multiple cytoplasmic inclusions seen in an enlarged cell?,yes
image37,Are the effector arms of these central circuits seen in an enlarged cell?,no
image38,Are the opened up chambers of the heart seen?,no
image38,Are a few well-developed cell nests with keratinisation evident?,yes
image38,What are a few well-developed cell nests with?,keratinisation
image38,Are islands of invading malignant squamous cells seen?,yes
image38,Are these tumour cells evident?,no
image39,Are cells obtained by fine-needle aspiration of a papillary carcinoma?,yes
image39,Are characteristic intranuclear inclusions visible in some of the aspirated cells?,yes
image39,Is wilms tumor visible in some of the aspirated cells?,no
image39,What is obtained by fine-needle aspiration of a papillary carcinoma?,cells
image40,"Is the cause of reversible injury at the right, in the specimen shown?",no
image40,"Is the placenta at the right, in the specimen shown?",yes
image40,Does the blue area extend from the portion of the amniotic sac to encircle the leg of the fetus?,no
image40,Does the band of amnion extend from the portion of the amniotic sac to encircle the leg of the fetus?,yes
image41,What are characterized by clusters of large ganglion cells with vesicular nuclei and abundant eosinophilic cytoplasm arrow?,ganglioneuromas
image41,Are infants who survive presented in the background stroma?,no
image41,Are Ganglioneuromas characterized by clusters of large ganglion cells with vesicular nuclei and abundant eosinophilic cytoplasm (arrow)?,yes
image41,Are spindle-shaped Schwann cells present in the background stroma?,yes
image41,Is a liver characterized by clusters of large ganglion cells with vesicular nuclei and abundant eosinophilic cytoplasm arrow?,no
image42,Is necrosis elicited by firm stroking of skin of forearm with a pencil?,no
image42,Is 'triple response ' elicited by firm stroking of skin of forearm with a pencil?,yes
image43,Is the wall of the artery composed of cells with abundant eosinophilic cytoplasm and small regular nuclei on this high-power view?,no
image43,Is the tumor composed of cells with abundant eosinophilic cytoplasm and small regular nuclei on this high-power view?,yes
image44,"Are the alveolar septa widened and thickened due to congestion, oedema and mild fibrosis?",yes
image44,Do the alveolar lumina contain heart failure cells alveolar macrophages containing haemosiderin pigment?,yes
image44,"Are the interstitial vasculature widened and thickened due to congestion, oedema and mild fibrosis?",no
image45,Is the background myxoid?,yes
image45,What is myxoid?,background
image45,Are the tumour cells quite variable in size having characteristic bubbly cytoplasm and anisonucleocytosis?,yes
image46,Is the stromal core composed of dense fibrous tissue which shows nonspecific inflammation?,yes
image46,What is covered by endocervical mucosa with squamous metaplasia?,surface
image46,Is the surface covered by endocervical mucosa with squamous metaplasia?,yes
image46,Is ALDH covered by endocervical mucosa with squamous metaplasia?,no
image46,Is moebic liver abscess composed of dense fibrous tissue which shows nonspecific inflammation?,no
image47,"Are pallor or halos around nuclei,  prominent keratohyalin granules,  and related cytopathic changes seen at higher magnification?",yes
image47,"Are the relative locations,  sizes,  and distances between genes seen at higher magnification?",no
image47,Does this specimen from a patient with periventricular leukomalacia contain zones of papillary epidermal proliferation that often radiate symmetrically like the points of a crown?,no
image47,Do common warts contain zones of papillary epidermal proliferation that often radiate symmetrically like the points of a crown?,yes
image48,"Does microscopic examination show marked epidermal hyperplasia,  downward extension of rete ridges,  and prominent parakeratotic scale with infiltrating neutrophils?",yes
image48,"Does rupture of a meningeal artery,  usually associated with a skull fracture,  show marked epidermal hyperplasia,  downward extension of rete ridges,  and prominent parakeratotic scale with infiltrating neutrophils?",no
image49,"Do hepatocytes contain mature cells from endodermal,  mesodermal,  and ectodermal lines?",no
image49,"Do testicular teratomas contain mature cells from endodermal,  mesodermal,  and ectodermal lines?",yes
image50,Does sectioned surface of the parotid gland show lobules of grey-white circumscribed tumour having semitranslucent parenchyma?,yes
image50,Does these cases show lobules of grey-white circumscribed tumour having semitranslucent parenchyma?,no
image51,Are the new virions crush-smeared by flat pressure with cover slip or glass slide ?,no
image51,Are semisolid aspirates crush-smeared by flat pressure with cover slip or glass slide ?,yes
image52,Does a scar smaller than the original wound aspirate show megaloblastic erythropoiesis?,no
image52,Does examination of bone marrow aspirate show megaloblastic erythropoiesis?,yes
image53,Does plaque show bundles of normal-looking smooth muscle cells?,no
image53,Does microscopic appearance of leiomyoma show bundles of normal-looking smooth muscle cells?,yes
image54,Are various types of epithelial cells stain with cytokeratin for epithelial cells?,no
image55,"Is the cyst wall densely infiltrated by chronic inflammatory cells, chiefly lymphocytes, plasma cells and macrophages?",yes
image55,"Is normal non-activated platelet, having open canalicular system and the cytoplasmic organelles densely infiltrated by chronic inflammatory cells, chiefly lymphocytes, plasma cells and macrophages?",no
image56,"Is the inner circle shown with green line comprised of ducts, acini, tubules, sheets and strands of cuboidal and myoepithelial cells?",no
image56,What is the epithelial element comprised of?,ducts
image56,"Is the epithelial element comprised of ducts, acini, tubules, sheets and strands of cuboidal and myoepithelial cells?",yes
image57,"Is the lumen filled by a large,  layered thrombus?",yes
image57,"Is the areas of white chalky deposits filled by a large,  layered thrombus?",no
image57,Is the wall of the aneurysm attenuated?,yes
image57,Is acute cellular rejection of a kidney graft attenuated?,no
image58,"Does embolus derived from a lower-extremity deep venous thrombus show several small malignant glands with enlarged nuclei,  prominent nucleoli,  and dark cytoplasm,  as compared with the larger,  benign gland?",no
image58,"Does higher magnification show several small malignant glands with enlarged nuclei,  prominent nucleoli,  and dark cytoplasm,  as compared with the larger,  benign gland?",yes
image58,Are the small glands crowded in between larger benign glands?,yes
image58,Are t_h17 cells crowded in between larger benign glands?,no
image59,Are a majority of the tumor cells involved by a superficial bacterial infection showing the characteristic erythematous scablike lesions crusted with dried serum?,no
image59,Is a child 's arm involved by a superficial bacterial infection showing the characteristic erythematous scablike lesions crusted with dried serum?,yes
image60,What has caseating epithelioid cell granulomas having Langhans 'giant cells and peripheral layer of lymphocytes?,stroma
image60,Has the mucosal caseating epithelioid cell granulomas having Langhans 'giant cells and peripheral layer of lymphocytes?,no
image60,Has the stroma caseating epithelioid cell granulomas having Langhans 'giant cells and peripheral layer of lymphocytes?,yes
image61,"Are undifferentiated pleomorphic sarcoma showing anaplastic relatively small,  symmetric,  and uniformly pigmented?",no
image61,"Are melanocytic nevi relatively small,  symmetric,  and uniformly pigmented?",yes
image62,Is the covering mucosa grey-white fleshy with areas of haemorrhage and necrosis?,no
image62,Is cut surface grey-white fleshy with areas of haemorrhage and necrosis?,yes
image62,Is iron somewhat circumscribed?,no
image62,Is the lobulated tumour infiltrating the skeletal muscle somewhat circumscribed?,yes
image63,Do infected cells show distinct nuclear inclusions?,yes
image63,Do energy stores show distinct nuclear inclusions?,no
image64,What is there throughout the entire thickness of the epithelium?,hyperkeratosis
image64,"Is there hyperkeratosis, parakeratosis, acanthosis, koilocytosis and presence of atypical anaplastic cells throughout the entire thickness of the epithelium?",yes
image64,"Is bone biopsy hyperkeratosis, parakeratosis, acanthosis, koilocytosis and presence of atypical anaplastic cells throughout the entire thickness of the epithelium?",no
image64,Does the central area show mitotic figures in the layers of squamous epithelium?,no
image64,Does photomicrograph on right under higher magnification show mitotic figures in the layers of squamous epithelium?,yes
image65,What is enlarged and heavy?,kidney
image65,Is the kidney enlarged and heavy?,yes
image65,Is the glomeruli enlarged and heavy?,no
image65,"Is the cystic change seen to extend into renal p arenchyma, compressing the cortex as a thin rim at the periphery?",yes
image65,"Is bone biopsy seen to extend into renal p arenchyma, compressing the cortex as a thin rim at the periphery?",no
image65,Are these cysts communicating with the pelvi-calyceal system unlike polycystic kidney?,yes
image66,"Are the interstitial vasculature widened and thickened due to congestion, oedema and mild fibrosis?",no
image66,Do line of demarcation between gangrenous segment and the viable bowel contain heart failure cells alveolar macrophages containing haemosiderin pigment?,no
image66,"Are the alveolar septa widened and thickened due to congestion, oedema and mild fibrosis?",yes
image66,Do the alveolar lumina contain heart failure cells alveolar macrophages containing haemosiderin pigment?,yes
image67,"How is a solitary,  well-circumscribed nodule in this gross specimen?",visible
image67,"How is a solitary,  well-circumscribed nodule in this gross specimen?",visible
image67,Is genomic dna visible in this gross specimen?,no
image67,"Is a solitary,  well-circumscribed nodule visible in this gross specimen?",yes
image67,"Is a solitary,  well-circumscribed nodule visible in this gross specimen?",yes
image67,Is borderline serous cystadenoma visible in this gross specimen?,no
image68,What is enlarged in size and weight?,kidney
image68,Is the kidney enlarged in size and weight?,yes
image68,What shows characteristic 'flea bitten kidney ' due to tiny petechial haemorrhages on the surface?,cortex
image68,Does the peripheral zone show characteristic 'flea bitten kidney ' due to tiny petechial haemorrhages on the surface?,no
image68,Does the cortex show characteristic 'flea bitten kidney ' due to tiny petechial haemorrhages on the surface?,yes
image69,What is attached to the kidney?,neuroblastoma
image69,Is FISH using a fluorescein-labeled cosmid probe for N-myc on a tissue section containing neuroblastoma attached to the kidney?,yes
image69,Is spindle-shaped schwann cells attached to the kidney?,no
image69,Does this correspond to amplified N-MYC in the form of homogeneously staining regions?,yes
image69,Does section of an involved lacrimal gland correspond to amplified N-MYC in the form of homogeneously staining regions?,no
image69,Do renal tubular epithelial cells in the lower half of the photograph show no nuclear staining and background cytoplasmic staining?,yes
image69,Do the photomicrographs show no nuclear staining and background cytoplasmic staining?,no
image70,"Does acute tubular epithelial cell injury with blebbing at the luminal pole,  detachment of tubular cells from their underlying basement membranes,  and granular cast?",yes
image70,"Whose underlying basement membranes is detachment of tubular cells from,  and granular casts?",their
image70,"Acute tubular epithelial cell injury with blebbing at the luminal pole , detachment of tubular cells from whose underlying basement membranes , and granular casts ?",their
image70,Does homogeneous or diffuse staining of nuclei cast?,no
image71,What are the tumour cells arranged in?,sheets
image71,"Are the tumour cells arranged in sheets, cords or aggregates and at places form pseudorosettes?",yes
image71,"Are scanty cytoplasm and markedly hyperchromatic nuclei arranged in sheets, cords or aggregates and at places form pseudorosettes?",no
image71,How are the individual tumour cells?,small
image71,"Are the individual tumour cells small, uniform, lymphocyte-like with scanty cytoplasm?",yes
image71,"Are some leucocytes and red cells and a tight meshwork small, uniform, lymphocyte-like with scanty cytoplasm?",no
image72,Is an asbestos body an asbestos fibre coated with glycoprotein and haemosiderin giving it beaded or dumbbell-shaped appearance with bulbous ends?,yes
image72,Is the interstitial vasculature an asbestos fibre coated with glycoprotein and haemosiderin giving it beaded or dumbbell-shaped appearance with bulbous ends?,no
image73,Is the segmental distribution in this case typical of ANCA (anti-neutrophil cytoplasmic antibody)- associated crescentic glomerulonephritis?,yes
image73,Does normal media for comparison indicate areas of necrosis and crescent formation?,no
